Product_Category,Category_name,Headline_for_TOP_Product,Teaser_text,Product_Top_1,Product_Top_1_Pro_Sentiment,Product_Top_2,Product_Top_2_Pro_Sentiment,Product_Top_3,Product_Top_3_Pro_Sentiment,Product_Top_1_Pros,Product_Top_1_Cons,Positive Quote,Summary_Reviews_High,Summary_Reviews_Low,Wrapup
0,Tablet,Unleash Learning and Fun with the Kid-Friendly Tablet!,"Fire Kids Edition Tablet - Unlocking a World of Fun and Learning! This 7-inch Wi-Fi tablet is the perfect companion for young explorers, featuring a vibrant display and a sturdy green kid-proof case. With 16 GB of storage, your little ones can enjoy a seamless streaming experience, whether it's their favorite movies, educational apps, or interactive games. Parents, rejoice! The lightweight design ensures easy mobility, and the positive reviews speak for themselves. It's a great choice for on-the-go entertainment and learning adventures. Get ready to ignite their curiosity!","Fire Kids Edition Tablet, 7 Display, Wi-Fi, 16 GB, Green Kid-Proof Case",4.81,"All-New Fire HD 8 Tablet, 8 HD Display, Wi-Fi, 16 GB - Includes Special Offers, Magenta",4.81,"Fire Tablet, 7 Display, Wi-Fi, 8 GB - Includes Special Offers, Magenta",4.78,"• Clear Display, Lightweight, Easy Streaming",Cons:,Great product The tablet is very light and streams well,"Users appreciate the lightweight design and streaming capabilities of this tablet, making it ideal for on-the-go entertainment. The additional memory options and responsiveness during web browsing and video streaming are also highly praised.","Users report that the touch screen responsiveness is inconsistent, particularly for those with cold fingers, and the device has an unusual behavior when charging while turned off, which is frustrating. Additionally, the product's durability is questioned, with some experiencing issues with its reading capabilities.","This tablet offers an impressive balance of performance and value, catering to various user needs. While praised for its lightweight design, streaming capabilities, and additional memory options, some users experience touch sensitivity issues and an odd charging quirk. Overall, it's an excellent choice for those seeking an affordable, versatile tablet."
2,Smart Home,Unleash Your Voice Assistant - Echo in White!,Echo (White) - Elevate Your Everyday with Affordable Excellence!,"Echo (White),,,
Echo (White),,,",4.86,"Amazon - Amazon Tap Portable Bluetooth and Wi-Fi Speaker - Black,,,
Amazon - Amazon Tap Portable Bluetooth and Wi-Fi Speaker - Black,,,",4.86,Amazon Echo,4.86,"- Clear, Crisp Display",Cons:,"Excellent Value for the Money Although this won't be competing with the iPad or some higher end android tablets, this easily outperforms any other tablet in this price range","The tablet offers exceptional value for money, surpassing expectations for its price range. Users appreciate its sturdy build quality, smooth performance, and overall satisfying user experience, making it a top choice for those seeking an affordable, high-performing tablet.","Users express disappointment with the certified refurbished Amazon Fire TV devices, reporting defective screens and boot-up issues. There is a concern regarding the refurbishment process, suggesting that Amazon should improve quality control to ensure customers receive properly functioning devices.","""This tablet offers impressive value for its price, surpassing competitors in the same range. With a sturdy build and solid performance, it meets expectations and delivers a satisfying user experience. However, concerns have been raised about the quality of refurbished models, which may require further attention from the manufacturer."""
3,eReader,Revolutionize Your Reading: Kindle Voyage - A Voyage to Endless Stories!,"Introducing the Kindle Voyage - Your Ultimate Reading Companion! With its sleek and lightweight design, this Category 3 device offers an exceptional reading experience. Reviewers rave about its perfect size, which makes it easy to hold and carry wherever your adventures take you. The stunning screen and precise control lighting ensure that reading is a delight, especially for those late-night reading sessions without disturbing your partner. Immerse yourself in your favorite books with the convenience of an e-reader that feels just right. The Kindle Voyage is a top choice for book lovers, providing an enjoyable and seamless reading journey.",Kindle Voyage,4.89,"Kindle Voyage E-reader, 6 High-Resolution Display (300 ppi) with Adaptive Built-in Light, PagePress Sensors, Wi-Fi - Includes Special Offers,",4.87,"Amazon Kindle Paperwhite - eBook reader - 4 GB - 6 monochrome Paperwhite - touchscreen - Wi-Fi - black,,,",4.85,"• Crisp, Clear Screen",Cons:,"Great Kindle A bit pricey, but worth the money in my opinion","The Kindle Voyage is highly praised for its compact size, adjustable lighting, and superior screen quality, making it an excellent e-reader for comfortable and convenient reading experiences, especially in low-light conditions. Users appreciate its portability and the ability to read without disturbing others.","Summary: There are no negative reviews available for this category, indicating overall satisfaction or a lack of feedback on potential issues.","The Kindle Voyage is a highly recommended e-reader, offering the perfect size, excellent lighting control, and a pleasurable reading experience. While some may find it a bit pricey, users appreciate its convenience, especially for reading in bed without disturbing others. This device seems to meet all expectations, as no negative reviews were found."
4,Other,Power Up Your Reading and Streaming! Amazon's Official Charger for Fire and Kindle - A Perfect Match.,"""Power up your reading and entertainment experience! The Amazon 5W USB Charger is the official boost your Fire Tablet and Kindle eReader need. With its efficient charging capabilities, users rave about the long-lasting battery life, making it the perfect companion for book lovers and app enthusiasts alike. Get yours now and unlock the full potential of your Amazon devices!""","Amazon 5W USB Official OEM Charger and Power Adapter for Fire Tablets and Kindle eReaders,,,
Amazon 5W USB Official OEM Charger and Power Adapter for Fire Tablets and Kindle eReaders,,,",4.05,"Amazon 9W PowerFast Official OEM USB Charger and Power Adapter for Fire Tablets and Kindle eReaders,,,
Amazon 9W PowerFast Official OEM USB Charger and Power Adapter for Fire Tablets and Kindle eReaders,,,",4.94,Amazon Echo,5.0,• Fast Charging,Cons:,Great tablet Fast fun tablet with great speakers compared to previous fire tablet,"Users appreciate the fast performance, enhanced speakers, and overall value for money of this tablet. Its ease of use, extensive app selection, and long-lasting battery life make it a popular choice.","Users report that the Amazon Fire HD8 tablet is difficult to navigate, with an interface less intuitive than that of an iPad. Additionally, there are concerns about the durability and quality of the device's charger, which seems to require frequent replacements, adding to the overall cost of ownership.","The tablet is praised for its speed, fun features, and improved speakers compared to its predecessor. However, some users express concerns about navigation difficulties and the durability of the charger, which may need frequent replacement. Overall, it offers an enjoyable experience but could benefit from some minor improvements."
