Product_Category,Category_name,Headline_for_TOP_Product,Teaser_text,Product_Top_1,Product_Top_1_Pro_Sentiment,Product_Top_2,Product_Top_2_Pro_Sentiment,Product_Top_3,Product_Top_3_Pro_Sentiment,Product_Top_1_Pros,Product_Top_1_Cons,Positive_Quote,Summary_Reviews_High,Summary_Reviews_Low,Wrapup
0,Tablet,A Portable Powerhouse!,"The latest tablet combines sleek design with powerful performance. Customers love its vivid display, long-lasting battery, and seamless multitasking capabilities, making it perfect for work, entertainment, and creativity.",iPad Pro 12.9”,4.5,Samsung Galaxy Tab S9 Ultra,4.0,Microsoft Surface Pro 9,3.5,"Stunning display, fast processor, great for artists",Expensive accessories required,“It’s like having a laptop in my hands!”,"Customers praised the high-quality displays, excellent performance, and versatility of these tablets.",Some users found the accessories costly and faced a learning curve with advanced features.,"A premium tablet experience for all needs, with excellent options from Samsung and Microsoft."
1,TV,Game-Changer for Streaming!,Discover the best Other products with our analysis of top picks and reviews.,Amazon Fire TV Stick 4K Max,5.0,Roku Streaming Stick 4K,4.5,Chromecast with Google TV,4.3,"Excellent 4K streaming, Alexa voice remote, fast processing",No free streaming services included,“Best upgrade for my TV – I love it!”,Some users appreciated the straightforward setup but suggested clearer navigation guides and enhanced connectivity stability. They also noted the option to expand their experience with additional app subscriptions.,"Some users reported lag during setup, lack of clarity in app navigation, and occasional connectivity issues. Others expressed disappointment that some apps required separate subscriptions.","Fire Stick delivers innovation, while Roku and Fire TV Cube offer premium alternatives."
2,Smart Home,"Your Home, Smarter!","Smart home devices revolutionize convenience and connectivity. Customers adore their ability to control lights, security, and appliances through voice commands or mobile apps.",Amazon Echo (5th Gen),4.3,Google Nest Hub Max,4.1,Philips Hue Smart Bulb,4.0,"Compact, Alexa integration, excellent sound quality",Limited non-Amazon ecosystem apps,“Alexa controls everything – it’s so easy!”,"Customers loved the convenience, voice assistant integration, and energy efficiency of these devices.",Some users mentioned compatibility issues with non-supported devices and minor delays in response times.,"A smart home essential with Alexa leading the way, supported by great alternatives."
3,eReader,Reading Redefined!,The latest eReaders bring books to life with crisp displays and weeks-long battery life. Customers love the convenience of carrying an entire library wherever they go.,Kindle Paperwhite,5.0,Kobo Libra 2,4.9,Nook GlowLight 4,4.7,"Waterproof, sharp display, extensive library",Heavily tied to Amazon ecosystem,“The Paperwhite is perfect for nighttime reading!”,"Users appreciated the sharp displays, long battery life, and ergonomic designs.",Some users wished for more format compatibility and faster touch response times.,"Kindle shines for avid readers, while Kobo and Nook offer solid alternatives for varied preferences."
4,Others,"Fast Charging, Anytime!","Modern chargers deliver speed and convenience with universal compatibility. Customers love their compact design, rapid charging, and reliable performance for multiple devices.",Anker PowerPort III,5.0,Belkin BoostCharge,4.5,Apple 20W USB-C,4.3,"Fast charging, compact, supports multiple devices",Slightly pricey for its category,“Charges my phone in no time!”,"Customers loved the fast charging, compact designs, and universal compatibility of these chargers.",Some users desired additional ports and felt certain models were overpriced.,"Anker leads with reliability, while Belkin and Apple are excellent for specific needs."